{
  "schema_version": 1,
  "created_at": "2026-06-20T20:49:59+00:00",
  "active_task": null,
  "path_locks": {},
  "last_run_id": null,
  "last_run_dir": ".fink/runs/20260621T104904Z-036cbe4b/FINK-S8-01/round-01",
  "last_verdict": "APPROVE",
  "latest_successful_commit": "b3803bfa4df0e72a1b8623e271d8f202eba3dbd1",
  "base_commit": "b3803bfa4df0e72a1b8623e271d8f202eba3dbd1",
  "round": 0,
  "icml_template_hashes": {
    "paper/template/icml2026/algorithm.sty": "93fd0eb31c112eb405833db8f1d7f5d238c7e691b1c05680d7276e68f36d564a",
    "paper/template/icml2026/algorithmic.sty": "48d18794a5d97c0479a588cc2eac0917992feb9da83acc4631b8f55757d80f9b",
    "paper/template/icml2026/example_paper.bib": "df950103d38f9cfc81b1f40d84c9be2a3525d046d2991a6973a4446922c06bd1",
    "paper/template/icml2026/example_paper.tex": "c2ca8140bf255d1ff77d1278eb3eefed4018b4b1e71065b8e1ccbc68b74c8acf",
    "paper/template/icml2026/fancyhdr.sty": "9130c52f91087abc6d223164ffa587e207e3257fcbcd069ef09ecb5391043f14",
    "paper/template/icml2026/icml2026.bst": "0ec3d5eb9b02efb7e0b44a32f3775882f42a743d0bdc618f34e6936309b98764",
    "paper/template/icml2026/icml2026.sty": "7cdcf90f6a59c5219e7f15c88f7ed09fcaf598dad91e6cdddc4dc3cb0e397a95",
    "paper/template/icml2026/icml_numpapers.pdf": "d34e8da982296363627996e6e18850c11fbd616e6946061237051e7a8f7080bb"
  }
}
